{
  "docs": "docs",
  "output": "dist",
  "title": "ğŸŒ“ Luna UI",
  "base": "/",
  "trailingSlash": true,
  "exclude": ["internal"],
  "i18n": {
    "defaultLocale": "en",
    "locales": [
      { "code": "en", "label": "English", "path": "" },
      { "code": "ja", "label": "æ—¥æœ¬èª", "path": "ja" }
    ]
  },
  "nav": [
    { "text": "ğŸ“– Guide", "link": "/guide/" },
    { "text": "ğŸŒ™ Tutorial (MoonBit)", "link": "/tutorial-moonbit/" },
    { "text": "âš¡ Tutorial (JS)", "link": "/tutorial-js/" },
    { "text": "ğŸŒŸ Astra SSG", "link": "/astra/" },
    { "text": "â˜€ï¸ Sol", "link": "/sol/" }
  ],
  "sidebar": "auto",
  "navigation": {
    "spa": true,
    "viewTransitions": false,
    "keyboard": true
  },
  "theme": {
    "primaryColor": "#fbbf24",
    "socialLinks": [
      { "icon": "github", "link": "https://github.com/prafster/luna.mbt" }
    ],
    "footer": {
      "message": "Released under the MIT License.",
      "copyright": "Copyright 2024 mizchi"
    }
  },
  "ogp": {
    "siteUrl": "https://luna.mbt",
    "image": "/og-image.png",
    "twitterHandle": "@mizchi",
    "twitterCard": "summary_large_image"
  }
}
